id, author, utterance, arg_label, arg_label
10:59, 11:59
0, jacqueline_maria_anna.sittig.stud-mail, "Es lohnt sich in den Einsatz von KI in der Diagnostik und Therapieentscheidung zu investieren, da die KI teilweise bereits jetzt auf dem Niveau von Fachärzt:innen ist und zu erwarten ist, dass sie im Laufe der Zeit das Niveau von Fachärzt:innen übertrifft.", pro_1 
1, justin.voelkel, "Das muss erst in klinischen Studien nachgewiesen werden. Außerdem dürfte sich die Aufbereitung der Daten, die für eine KI unerlässlich sind, als sehr schwierig und kostenintensiv gestalten.", pro_1.1, pro_2.2
2, jacqueline_maria_anna.sittig.stud-mail, "Um den Nachweis erbringen zu können, müsste der KI die Möglichkeit gegeben werden sich zu beweisen. Wenn die Daten einmal eingepflegt sind, vergisst sie die KI jedoch nicht. Gerade im Hinblick auf die vielen weiteren Vorteile lohnt sich die schwierige und kostenintensive Aufbereitung der Daten. Zum Beispiel, dass die Leistung der KI standardisiert und reproduzierbar ist, sie hängt also nicht wie bei Ärzt:innen von den unterschiedlichen Fähigkeiten der Ärzt:innen ab.", pro_1.1, pro_23, pro_3
3, justin.voelkel, "Die KI mag ja mit sehr vielen Daten trainiert und besser umgehen können als Ärzt:innen. Allerdings gibt es hier den Datenschutzrecht zu beachten, da diese Menge an Daten in der Konsequenz zu gläsernen Bürgern führen kann. Außerdem ziehen Fehler der KI hohe Schadenersatzforderungen mit sich. Nicht nur die Hersteller könnten verantwortlich gemacht werden, sondern auch die Kliniken würden hohe Schadensersatzforderungen begleichen müssen.", pro_2.1, con_5
4, jacqueline_maria_anna.sittig.stud-mail, "Dem Datenschutz würde entsprochen werden, wenn die Daten nur anonymisiert gespeichert würden. Es gibt Maßnahmen um Schadensersatzforderungen entsprechen zu können, etwa durch Haftungsfonds oder einer Versicherungspflicht. Dies sollte kein Grund darstellen um einem technischen Fortschritt zu verhindern. Tatsächlich könnte durch den Einsatz von KI weniger Schaden entstehen; Die KI ist immer auf dem neusten Stand der Forschung und kann so die beste Therapieempfehlung aussprechen.", pro_2.1.1, con_5.1, con_5.2, pro_20, pro_21
5, justin.voelkel, "Zu Beginn des breiten Einsatzes der Technologie könnten die Beträge für der derartige Fonds zu hoch sein, als dass es Unternehmen finanzieren wollten / könnten. Hinzukommt, dass durch die großen Mengen an benötigten Daten, die Kliniken umso interessanter für Hacker Angriffe werden. Während Fehler von einzelnen Ärzt:innen gemacht werden, wird eine fehlerhafte KI wahrscheinlich an zahlreichen Standorten eingesetzt, wodurch Fehler und somit auch die Schäden deutlich gravierender ausfallen können, auch wenn sich diese in der Anzahl verringern.", con_5.1.1, con_7, con_26
6, jacqueline_maria_anna.sittig.stud-mail, "Die Beiträge würden sich wohl im Preis der KI niederschlagen und sich für die Unternehmen amortisieren. Zudem ist auch an staatliche Förderung zu denken. Natürlich müssten die Daten vor Hacker-Angriffen geschützt werden. Kliniken müssen sich jedoch aufgrund der zunehmenden Digitalisierung ohnehin gegen Cyber-Angriffe schützen.", con_5.2, con_5.1.1.2, con_7.2
7, justin.voelkel, "Hierdurch entsteht ein Mehraufwand, etwa hinsichtlich Umsetzung und Kontrolle der Einhaltung des Datenschutzes, der sich gerade auch in den Kosten wiederspiegeln würde. Aber mal von den finanziellen Aspekten abgesehen, wie aussagekräftig sind die Diagnosen bzw. Ergebnisse der KI, wenn sie keine für die Fachärzt:innen verständliche und nachvollziehbare Erklärung mitliefern kann?", con_7.2.1, con_2
8, jacqueline_maria_anna.sittig.stud-mail, "Die KI könnte jedoch die Zwischenschritte anzeigen, auf denen die Diagnose aufgebaut ist. Abgesehen davon ist es nicht immer entscheidend, wie die KI zu ihrem Ergebnis gekommen ist, da die Endentscheidung nach wie vor von Ärzt:innen getroffen werden kann. Im Endergebnis überwiegen meiner Meinung nach die Vorteile des Einsatzes der KI.", con_2.1, con_3.2, pro_21