id, author, utterance, arg_label, arg_label, arg_label
17:57, 18:24
0, antonia.krause.stud-mail, "Durch die KI wird eine Verlegung des Patienten nur aus Gründen der Bilddiagnostik vermieden. Damit geht ebenso deine Reduzierung von zeitlichen Verzögerungen bei Untersuchungen und Transportrisiken einher.", pro_8
1, kai.weisenberger, "Die Bildaufnahme müsste aber unverändert mit den bestehenden Vorrichtungen vorgenommen werden. Lediglich die Interpretation und Analyse würde von der KI übernommen. Insofern bestünde also keine Verbesserung.", pro_8.1
2, antonia.krause.stud-mail, "Oft wird es nicht an den Vorrichtungen vor Ort scheitern, da ein Röntgengerät, CT und MRT etc. wohl übliche medizinische Geräte in Krankenhäusern darstellen. Es scheitert vielmehr an einer fähigen Person, die die aufgenommenen Bilder in adäquater Weise auswertet.", pro_7
3, kai.weisenberger, "Wenn es diesbezüglich einen Mangel gibt muss dieser eben mit zusätzlichen Investitionen amortisiert werden. Im Gesundheitssektor sollte nicht gespart werden.", pro_7.1
4, antonia.krause.stud-mail, "Den Mangel an Spezialisten, die sich insbesondere mit der Bildauswertung befassen wird es schwer sein in angemessener Weise zu kompensieren, da es hierzu vor allem Erfahrung braucht. Das Geld was durch KI eingespart wird, sollte lieber an anderer Stelle zum Einsatz kommen.", pro_7.1.1
5, kai.weisenberger, "Die Entwicklung einer KI, die irgendwann möglicherweise einmal das Niveau eines Menschen erreichen kann ist eine sehr große Investition und auch ein Risiko. Es ist nicht sicher, dass damit breitflächig Geld gespart werden kann.", con_17
6, antonia.krause.stud-mail, "Der Meinung bin ich schon. Gerade bezüglich des radiologischen Arbeitsentgelts besteht ein sehr großes Einsparungspotenzial, da sich die KI in diesem Bereich bereits auf vergleichbarem wenn nicht sogar höheren Niveau befindet als die Arbeit eines Arztes.", con_17.1
7, kai.weisenberger, "Eine KI würde andererseits hohe Entwicklungskosten aufwerfen, die zunächst investiert werden müssten. Im Verlauf der Nutzung kämen dann Kosten für die Instandhaltung, Pflege und Verbesserung hinzu.", con_17
8, antonia.krause.stud-mail, "Da stimme ich dir zu. Durch den Einsatz von KI kann in Zukunft aber eine bezahlbare medizinische Versorgung gewährleistet werden, die allen Patienten zugute kommen würde. Stellt man diese beiden Interessen gegenüber sollten nicht die monetären Belange überwiegen.", pro_11.1
